<?xml version="1.0" encoding="UTF-8" ?>
<?xml-stylesheet type="text/xsl" href="S2.xsl"?>
<forecast queryTime="13/10/2025 4:30PM" queryLocation="Singapore" 
          xmlns:xsi="http://www.w3.org/2001/XMLSchema-instance"
          xsi:noNamespaceSchemaLocation="S2.xsd">
  <weather yyyymmdd="20250530">
    <year>2025</year>	
    <month>5</month>
    <date>30</date>
    <dayOfWeek>Fri</dayOfWeek> 
    <overall>Considerable clouds</overall>
    <overallCode>cloudy</overallCode>
    <highest>30</highest>
    <lowest>29</lowest>
  </weather>
  <weather yyyymmdd="20250615">
    <year>2025</year>	
    <month>6</month>
    <date>15</date>
    <dayOfWeek>Sun</dayOfWeek> 
    <overall>Cloudy with a thunderstorm</overall>
    <overallCode>thunderstorm</overallCode>
    <highest>29</highest>
    <lowest>26</lowest>
  </weather>
  <weather yyyymmdd="20251006">
    <year>2025</year>	
    <month>10</month>
    <date>6</date>
    <dayOfWeek>Mon</dayOfWeek> 
    <overall>Afternoon shower</overall>
    <overallCode>rain</overallCode>
    <highest>37</highest>
    <lowest>30</lowest>
  </weather>
  <weather yyyymmdd="20250709">
    <year>2025</year>	
    <month>7</month>
    <date>9</date>
    <dayOfWeek>Wed</dayOfWeek> 
    <overall>A morning shower, then rain</overall>
    <overallCode>rain</overallCode>
    <highest>35</highest>
    <lowest>30</lowest>
  </weather>
  <weather yyyymmdd="20250410">
    <year>2025</year>	
    <month>4</month>
    <date>10</date>
    <dayOfWeek>Thur</dayOfWeek> 
    <overall>Partly sunny</overall>
    <overallCode>partlySunny</overallCode>
    <highest>33</highest>
    <lowest>31</lowest>
  </weather>
  <weather yyyymmdd="20250608">
    <year>2025</year>	
    <month>6</month>
    <date>8</date>
    <dayOfWeek>Sun</dayOfWeek> 
    <overall>Plenty of sunshine</overall>
    <overallCode>sunny</overallCode>
    <highest>35</highest>
    <lowest>32</lowest>
  </weather>
</forecast>